{
  "schema_version": 1,
  "archive_schema_version": "oqs-project-archive/v1",
  "project_id": "22222222-2222-4222-8222-222222222222",
  "activity_ids": ["33333333-3333-4333-8333-333333333333"],
  "selected_logs": "warn_error",
  "created_at": "2026-08-12T02:03:00+08:00",
  "git": {
    "bundle_path": "git/project.bundle",
    "sha256": "bbbbbbbbbbbbbbbbbbbbbbbbbbbbbbbbbbbbbbbbbbbbbbbbbbbbbbbbbbbbbbbb",
    "byte_size": 4096,
    "object_format": "sha1",
    "refs": [
      {
        "name": "refs/oqs/revisions/77777777-7777-4777-8777-777777777777",
        "oid": "cccccccccccccccccccccccccccccccccccccccc"
      }
    ]
  },
  "run_spec_ids": ["17171717-1717-4171-8171-171717171717"],
  "run_ids": ["18181818-1818-4181-8181-181818181818"],
  "report_artifact_ids": ["45454545-4545-4545-8545-454545454545"],
  "cas_objects": [
    {
      "sha256": "dddddddddddddddddddddddddddddddddddddddddddddddddddddddddddddddd",
      "path": "cas/sha256/dd/dddddddddddddddddddddddddddddddddddddddddddddddddddddddddddddddd",
      "byte_size": 512
    }
  ]
}
